{
  "canonical_source_sha256": "eafb79e32131321f8e23d6b54ffdbb3d9e05d9a708f91d361c4ba957cb4a2524",
  "generated_at": "2026-08-08T17:54:42Z",
  "hosts": [
    {
      "files": [
        {
          "path": "generic/LICENSE",
          "sha256": "cfc7749b96f63bd31c3c42b5c471bf756814053e847c10f3eb003417bc523d30"
        },
        {
          "path": "generic/LICENSE.md",
          "sha256": "43aa8e798403d806a159b49d182a220644b0e888b52106e85526e3699ed44b05"
        },
        {
          "path": "generic/LICENSES/Apache-2.0.txt",
          "sha256": "cfc7749b96f63bd31c3c42b5c471bf756814053e847c10f3eb003417bc523d30"
        },
        {
          "path": "generic/LICENSES/CC-BY-4.0.txt",
          "sha256": "9ba9550ad48438d0836ddab3da480b3b69ffa0aac7b7878b5a0039e7ab429411"
        },
        {
          "path": "generic/README.md",
          "sha256": "dcb3fce686211834dbee84db42cf74d9be7cfd7e491c10c4e9d1af9220c08d15"
        },
        {
          "path": "generic/THIRD_PARTY_NOTICES.md",
          "sha256": "13ce8164065512b6c5245ea4d8637e9eb886354cd1cd6e901b3bbdec22003a26"
        },
        {
          "path": "generic/ats-assess/SKILL.md",
          "sha256": "f7ee63f7cbef8b70407457ed9f9b07b123d45e9cfe0e23cfa08a8e373814012c"
        },
        {
          "path": "generic/ats-review/SKILL.md",
          "sha256": "cacc4c9e5ea7e217cc60a5c6d73ca397814197e846536693292ea16e76435a72"
        },
        {
          "path": "generic/ats-spec/SKILL.md",
          "sha256": "3fab6b730f4235ebbae34c08bb5699f578fcf01a4a35a294d1e0735feae454e9"
        },
        {
          "path": "generic/ats/SKILL.md",
          "sha256": "f0e72a9bd07b7bcfa6a96d9c98c6b3beff588900d42bda9997df4ea767f0cd40"
        },
        {
          "path": "generic/recipes/ARTIFACT_RECIPES.md",
          "sha256": "764edbbb1d588e617f60320cf29528f3de3a9dba4ca915ecd6b3597b2b3068db"
        },
        {
          "path": "generic/recipes/architecture.md",
          "sha256": "df7208d03f37b385da2b855af4efaf5094a3fc036d9ab11ed2d354b79a4cab4c"
        },
        {
          "path": "generic/recipes/diagnostic.md",
          "sha256": "eeb26d7868b3232b5aa2020f7ffa378cffef7f494e61a05a69bb4096d2b1077b"
        },
        {
          "path": "generic/recipes/implementation_program.md",
          "sha256": "1d9dc76241e94a2cea156f0e5b79994839eb71415d03d2691e133f66bd52ebed"
        },
        {
          "path": "generic/recipes/postmortem.md",
          "sha256": "653d59dfc67e48274851efa2082eb48fa1ebe0b7f7d81b86146301d1d1021805"
        },
        {
          "path": "generic/recipes/rfc_technical_proposal.md",
          "sha256": "cf00dd6797c237359f5226647353792aee36a5daad3014ef1f11321cf2e05bef"
        }
      ],
      "identity": "generic"
    },
    {
      "files": [
        {
          "path": "claude/LICENSE",
          "sha256": "cfc7749b96f63bd31c3c42b5c471bf756814053e847c10f3eb003417bc523d30"
        },
        {
          "path": "claude/LICENSE.md",
          "sha256": "43aa8e798403d806a159b49d182a220644b0e888b52106e85526e3699ed44b05"
        },
        {
          "path": "claude/LICENSES/Apache-2.0.txt",
          "sha256": "cfc7749b96f63bd31c3c42b5c471bf756814053e847c10f3eb003417bc523d30"
        },
        {
          "path": "claude/LICENSES/CC-BY-4.0.txt",
          "sha256": "9ba9550ad48438d0836ddab3da480b3b69ffa0aac7b7878b5a0039e7ab429411"
        },
        {
          "path": "claude/README.md",
          "sha256": "b509af7fe0e7c55d50267d0acc96759779ccdea66fed41a004e32855f03aa3c9"
        },
        {
          "path": "claude/THIRD_PARTY_NOTICES.md",
          "sha256": "13ce8164065512b6c5245ea4d8637e9eb886354cd1cd6e901b3bbdec22003a26"
        },
        {
          "path": "claude/ats-assess/SKILL.md",
          "sha256": "f7ee63f7cbef8b70407457ed9f9b07b123d45e9cfe0e23cfa08a8e373814012c"
        },
        {
          "path": "claude/ats-review/SKILL.md",
          "sha256": "cacc4c9e5ea7e217cc60a5c6d73ca397814197e846536693292ea16e76435a72"
        },
        {
          "path": "claude/ats-spec/SKILL.md",
          "sha256": "3fab6b730f4235ebbae34c08bb5699f578fcf01a4a35a294d1e0735feae454e9"
        },
        {
          "path": "claude/ats/SKILL.md",
          "sha256": "f0e72a9bd07b7bcfa6a96d9c98c6b3beff588900d42bda9997df4ea767f0cd40"
        },
        {
          "path": "claude/references/ARTIFACT_RECIPES.md",
          "sha256": "764edbbb1d588e617f60320cf29528f3de3a9dba4ca915ecd6b3597b2b3068db"
        },
        {
          "path": "claude/references/architecture.md",
          "sha256": "df7208d03f37b385da2b855af4efaf5094a3fc036d9ab11ed2d354b79a4cab4c"
        },
        {
          "path": "claude/references/diagnostic.md",
          "sha256": "eeb26d7868b3232b5aa2020f7ffa378cffef7f494e61a05a69bb4096d2b1077b"
        },
        {
          "path": "claude/references/implementation_program.md",
          "sha256": "1d9dc76241e94a2cea156f0e5b79994839eb71415d03d2691e133f66bd52ebed"
        },
        {
          "path": "claude/references/postmortem.md",
          "sha256": "653d59dfc67e48274851efa2082eb48fa1ebe0b7f7d81b86146301d1d1021805"
        },
        {
          "path": "claude/references/rfc_technical_proposal.md",
          "sha256": "cf00dd6797c237359f5226647353792aee36a5daad3014ef1f11321cf2e05bef"
        }
      ],
      "identity": "claude"
    },
    {
      "files": [
        {
          "path": "codex/LICENSE",
          "sha256": "cfc7749b96f63bd31c3c42b5c471bf756814053e847c10f3eb003417bc523d30"
        },
        {
          "path": "codex/LICENSE.md",
          "sha256": "43aa8e798403d806a159b49d182a220644b0e888b52106e85526e3699ed44b05"
        },
        {
          "path": "codex/LICENSES/Apache-2.0.txt",
          "sha256": "cfc7749b96f63bd31c3c42b5c471bf756814053e847c10f3eb003417bc523d30"
        },
        {
          "path": "codex/LICENSES/CC-BY-4.0.txt",
          "sha256": "9ba9550ad48438d0836ddab3da480b3b69ffa0aac7b7878b5a0039e7ab429411"
        },
        {
          "path": "codex/README.md",
          "sha256": "df26d05ffaf5b5a742bb211d79cc8b5618c87cb6ee116e1f85a1a1980f6febc9"
        },
        {
          "path": "codex/THIRD_PARTY_NOTICES.md",
          "sha256": "13ce8164065512b6c5245ea4d8637e9eb886354cd1cd6e901b3bbdec22003a26"
        },
        {
          "path": "codex/ats-assess/SKILL.md",
          "sha256": "f7ee63f7cbef8b70407457ed9f9b07b123d45e9cfe0e23cfa08a8e373814012c"
        },
        {
          "path": "codex/ats-review/SKILL.md",
          "sha256": "cacc4c9e5ea7e217cc60a5c6d73ca397814197e846536693292ea16e76435a72"
        },
        {
          "path": "codex/ats-spec/SKILL.md",
          "sha256": "3fab6b730f4235ebbae34c08bb5699f578fcf01a4a35a294d1e0735feae454e9"
        },
        {
          "path": "codex/ats/SKILL.md",
          "sha256": "f0e72a9bd07b7bcfa6a96d9c98c6b3beff588900d42bda9997df4ea767f0cd40"
        },
        {
          "path": "codex/recipes/ARTIFACT_RECIPES.md",
          "sha256": "764edbbb1d588e617f60320cf29528f3de3a9dba4ca915ecd6b3597b2b3068db"
        },
        {
          "path": "codex/recipes/architecture.md",
          "sha256": "df7208d03f37b385da2b855af4efaf5094a3fc036d9ab11ed2d354b79a4cab4c"
        },
        {
          "path": "codex/recipes/diagnostic.md",
          "sha256": "eeb26d7868b3232b5aa2020f7ffa378cffef7f494e61a05a69bb4096d2b1077b"
        },
        {
          "path": "codex/recipes/implementation_program.md",
          "sha256": "1d9dc76241e94a2cea156f0e5b79994839eb71415d03d2691e133f66bd52ebed"
        },
        {
          "path": "codex/recipes/postmortem.md",
          "sha256": "653d59dfc67e48274851efa2082eb48fa1ebe0b7f7d81b86146301d1d1021805"
        },
        {
          "path": "codex/recipes/rfc_technical_proposal.md",
          "sha256": "cf00dd6797c237359f5226647353792aee36a5daad3014ef1f11321cf2e05bef"
        }
      ],
      "identity": "codex"
    },
    {
      "files": [
        {
          "path": "agent-plugins/LICENSE",
          "sha256": "cfc7749b96f63bd31c3c42b5c471bf756814053e847c10f3eb003417bc523d30"
        },
        {
          "path": "agent-plugins/LICENSE.md",
          "sha256": "43aa8e798403d806a159b49d182a220644b0e888b52106e85526e3699ed44b05"
        },
        {
          "path": "agent-plugins/LICENSES/Apache-2.0.txt",
          "sha256": "cfc7749b96f63bd31c3c42b5c471bf756814053e847c10f3eb003417bc523d30"
        },
        {
          "path": "agent-plugins/LICENSES/CC-BY-4.0.txt",
          "sha256": "9ba9550ad48438d0836ddab3da480b3b69ffa0aac7b7878b5a0039e7ab429411"
        },
        {
          "path": "agent-plugins/README.md",
          "sha256": "71465bde7233ef4fefccebf20a3547cdb312409211a76a9989b644887696ae4a"
        },
        {
          "path": "agent-plugins/THIRD_PARTY_NOTICES.md",
          "sha256": "13ce8164065512b6c5245ea4d8637e9eb886354cd1cd6e901b3bbdec22003a26"
        },
        {
          "path": "agent-plugins/plugin.json",
          "sha256": "0846ca759333178e764e7bc3d12ee39c6aa4b4a99f30a60d6f707a581f045819"
        },
        {
          "path": "agent-plugins/references/ARTIFACT_RECIPES.md",
          "sha256": "764edbbb1d588e617f60320cf29528f3de3a9dba4ca915ecd6b3597b2b3068db"
        },
        {
          "path": "agent-plugins/references/architecture.md",
          "sha256": "df7208d03f37b385da2b855af4efaf5094a3fc036d9ab11ed2d354b79a4cab4c"
        },
        {
          "path": "agent-plugins/references/diagnostic.md",
          "sha256": "eeb26d7868b3232b5aa2020f7ffa378cffef7f494e61a05a69bb4096d2b1077b"
        },
        {
          "path": "agent-plugins/references/implementation_program.md",
          "sha256": "1d9dc76241e94a2cea156f0e5b79994839eb71415d03d2691e133f66bd52ebed"
        },
        {
          "path": "agent-plugins/references/postmortem.md",
          "sha256": "653d59dfc67e48274851efa2082eb48fa1ebe0b7f7d81b86146301d1d1021805"
        },
        {
          "path": "agent-plugins/references/rfc_technical_proposal.md",